{
  "$schema": "https://json-schema.org/draft/2020-12/schema",
  "$id": "https://example.com/schemas/videos.schema.json",
  "type": "array",
  "items": {
    "type": "object",
    "properties": {
      "id":        { "type": "string", "pattern": "^[0-9a-f]{32}$" },
      "title":     { "type": "string", "minLength": 1 },
      "duration":  { "type": "integer", "minimum": 1 },
      "questions": {
        "type": "array",
        "items": { "type": "string", "minLength": 1 },
        "minItems": 1
      }
    },
    "required": ["id", "title", "duration", "questions"],
    "additionalProperties": false
  }
}