[
  {
    "id": "8b7d93e0affeb91dee75ab682befc52e",
    "title": "Летающая гречка",
    "duration": 258,
    "questions": [
      "Как ты думаешь, почему гречка «летала»? Что заставляло её двигаться?",
      "Видел ли ты дома предметы, которые дрожат или подпрыгивают из-за звука или вибрации?"
    ]
  },
  {
    "id": "ae7e47f99eeb117cd5fe58adb00a37e2",
    "title": "Крякающий стаканчик",
    "duration": 685,
    "questions": [
      "Что издавало звук, похожий на кряканье? Как получался этот звук?",
      "Можешь ли ты придумать другой предмет, который тоже можно заставить «крякать»?"
    ]
  },
  {
    "id": "a7456f6195cffc787d8794d2e927c923",
    "title": "Объём тела",
    "duration": 288,
    "questions": [
      "Как в опыте измерили объём предмета неправильной формы?",
      "Как бы ты сам измерил объём картофелины или камня дома?"
    ]
  },
  {
    "id": "09cce125281e59ac985e5b81d37a1cb4",
    "title": "Плотность вещества",
    "duration": 387,
    "questions": [
      "Почему одни предметы тонут в воде, а другие плавают?",
      "Назови два предмета дома, у которых разная плотность."
    ]
  },
  {
    "id": "c14bc755bd761983639720f0a22022b5",
    "title": "Плавление и отвердевание кристаллических тел",
    "duration": 231,
    "questions": [
      "Что происходит с веществом, когда оно плавится?",
      "Приведи пример вещества, которое ты видел плавящимся или замерзающим."
    ]
  },
  {
    "id": "d7cb9f233b1e83686875b1ea7212a5c4",
    "title": "Кипение и конденсация",
    "duration": 257,
    "questions": [
      "Куда «исчезает» вода, когда чайник кипит?",
      "Видел ли ты капельки воды на холодном стакане летом? Почему они там появляются?"
    ]
  },
  {
    "id": "c68454dcacfbed271a684ed9a6daecaf",
    "title": "Охлаждение испарением",
    "duration": 227,
    "questions": [
      "Почему нам становится прохладно, когда мокрая кожа обсыхает на воздухе?",
      "Как люди используют это явление в жаркую погоду?"
    ]
  },
  {
    "id": "5b380b2767019ca23535fbee2572413b",
    "title": "Шуховская башня",
    "duration": 188,
    "questions": [
      "Почему башня сделана из сетчатых конструкций, а не из сплошного металла?",
      "Как ты думаешь, зачем людям строить такие высокие башни?"
    ]
  }
]
