[
  {
    "id": "8b7d93e0affeb91dee75ab682befc52e",
    "title": "Летающая гречка",
    "duration": 258,
    "questions": [
      "Как ты думаешь, почему гречка «летала»? Что заставляло её двигаться?",
      "Видел ли ты дома предметы, которые дрожат или подпрыгивают из-за звука или вибрации?"
    ]
  },
  {
    "id": "ae7e47f99eeb117cd5fe58adb00a37e2",
    "title": "Крякающий стаканчик",
    "duration": 685,
    "questions": [
      "Что издавало звук, похожий на кряканье? Как получался этот звук?",
      "Можешь ли ты придумать другой предмет, который тоже можно заставить «крякать»?"
    ]
  },
  {
    "id": "a7456f6195cffc787d8794d2e927c923",
    "title": "Объём тела",
    "duration": 288,
    "questions": [
      "Как в опыте измерили объём предмета неправильной формы?",
      "Как бы ты сам измерил объём картофелины или камня дома?"
    ]
  },
  {
    "id": "09cce125281e59ac985e5b81d37a1cb4",
    "title": "Плотность вещества",
    "duration": 387,
    "questions": [
      "Почему одни предметы тонут в воде, а другие плавают?",
      "Назови два предмета дома, у которых разная плотность."
    ]
  },
  {
    "id": "c14bc755bd761983639720f0a22022b5",
    "title": "Плавление и отвердевание кристаллических тел",
    "duration": 231,
    "questions": [
      "Что происходит с веществом, когда оно плавится?",
      "Приведи пример вещества, которое ты видел плавящимся или замерзающим."
    ]
  },
  {
    "id": "b7fbaa2abf77ed83d9d0d027f191ca90",
    "title": "Электрические заряды",
    "duration": 630,
    "questions": [
      "Почему натёртая трубка притягивает бумажки? Откуда берётся притяжение?",
      "Какие два вида зарядов бывают и как они ведут себя друг с другом?"
    ]
  },
  {
    "id": "88d8839f54ea2941bab5698a2f32b441",
    "title": "Самозапускающийся сифон",
    "duration": 504,
    "questions": [
      "Как сифон поднимает воду через препятствие без насоса?",
      "Чем самозапускающийся сифон отличается от обычного?"
    ]
  },
  {
    "id": "c01f1414a2931b5352807b202e7c5f86",
    "title": "Наклонная плоскость",
    "duration": 282,
    "questions": [
      "Почему по наклонной плоскости поднимать груз легче?",
      "Где ты видел наклонные плоскости вокруг себя — дома или на улице?"
    ]
  }
]
